<?xml version="1.0" encoding="UTF-8"?>
<!--
This material is the exclusive property of KUKA Roboter GmbH.
Except as expressly permitted by separate agreement, this material may only
be used by members of the development department of KUKA Roboter GmbH
for internal development purposes of KUKA Roboter GmbH.

Copyright (C) 2015
KUKA Roboter GmbH, Germany. All Rights Reserved

<CL>
*****************************************************************************
 Datum       Programmer          Reviewer
             Description
*****************************************************************************
 27.08.2015  Ueberle             Fuerst, ID 3137*
             Creation
*****************************************************************************
</CL>
-->
<MonitoredDataDependency xmlns:xsi="http://www.w3.org/2001/XMLSchema-instance"
                         xsi:noNamespaceSchemaLocation="MonitoredDataDependency.xsd">

    <MadaType KinType="E_SERIAL_KINEMATICS" hasSafePos="true" hasSafeTor="true">
        <BaseLoad>
            <CalcUnit Name="BASE_LOAD_LBR5"></CalcUnit>
        </BaseLoad>
    </MadaType>

    <MadaType KinType="E_SERIAL_KINEMATICS" hasSafePos="true" hasSafeTor="false">
        <BaseLoad>
            <CalcUnit Name="BASE_LOAD_AGILUS"></CalcUnit>
        </BaseLoad>
    </MadaType>

    <MadaType KinType="E_SERIAL_KINEMATICS" hasSafePos="false" hasSafeTor="false">
        <BaseLoad>
            <CalcUnit Name="BASE_LOAD_LBR4"></CalcUnit>
        </BaseLoad>
    </MadaType>

    <MadaType KinType="E_OMNIDIRECTIONAL_KINEMATICS" hasSafePos="true" hasSafeTor="false">
        <BaseLoad>
            <CalcUnit Name="BASE_LOAD_KMP"></CalcUnit>
        </BaseLoad>
    </MadaType>

</MonitoredDataDependency>
